"Title"	"Series"	"Contributors"	"Average Rating"	"Number of Ratings"	"Number of Reviews"	"Description"	"Number of Pages"	"Publishing Date"	"Genres"	"Setting"	"Characters"	"ISBN"	"Language"	"URL"
"The Hunger Games"	"The Hunger Games"	"Suzanne Collins"	"4.35"	"9,777,460"	"257,891"	"Winning means fame and fortune. Losing means certain death. The Hunger Games have begun. . . .In the ruins of a place once known as North America lies the nation of Panem, a shining Capitol surrounded by twelve outlying districts. The Capitol is harsh and cruel and keeps the districts in line by forcing them all to send one boy and one girl between the ages of twelve and eighteen to participate in the annual Hunger Games, a fight to the death on live TV.Sixteen-year-old Katniss Everdeen regards it as a death sentence when she steps forward to take her sister's place in the Games. But Katniss has been close to dead before-and survival, for her, is second nature. Without really meaning to, she becomes a contender. But if she is to win, she will have to start making choices that weigh survival against humanity and life against love.Show more"	"374"	"September 14, 2008"	"Young Adult; Dystopia; Fiction; Fantasy; Science Fiction; Romance; Adventure"	"Unknown"	"Unknown"	"Unknown"	"Unknown"	"https://www.goodreads.com/book/show/2767052-the-hunger-games"
"Harry Potter and the Sorcerer's Stone"	"Harry Potter"	"J.K. Rowling; Olly Moss"	"4.47"	"11,271,261"	"190,248"	"An alternative cover for this ASIN can be foundhere"Turning the envelope over, his hand trembling, Harry saw a purple wax seal bearing a coat of arms; a lion, an eagle, a badger and a snake surrounding a large letter 'H'."Harry Potter has never even heard of Hogwarts when the letters start dropping on the doormat at number four, Privet Drive. Addressed in green ink on yellowish parchment with a purple seal, they are swiftly confiscated by his grisly aunt and uncle. Then, on Harry's eleventh birthday, a great beetle-eyed giant of a man called Rubeus Hagrid bursts in with some astonishing news: Harry Potter is a wizard, and he has a place at Hogwarts School of Witchcraft and Wizardry. An incredible adventure is about to begin!Show more"	"333"	"December 8, 2015"	"Fantasy; Fiction; Young Adult; Harry Potter; Magic; Childrens; Audiobook"	"London, England(, 1991),Hogwarts School of Witchcraft and Wizardry(United Kingdom, 1991),England"	"Ron Weasley,Petunia Dursley,Vernon Dursley,Dudley Dursley,Severus Snape,Quirinus Quirrell,Rubeus Hagrid,Lord Voldemort,Minerva McGonagall,Neville Longbottom,Fred Weasley,George Weasley,Percy Weasley,Filius Flitwick,Pomona Sprout,Molly Weasley,Poppy Pomfrey,Oliver Wood,Parvati Patil,Dean Thomas,James Potter,Lily Potter,Seamus Finnigan,Garrick Ollivander,Rolanda Hooch,Katie Bell,Draco Malfoy,Albus Dumbledore,Dedalus Diggle,Harry Potter,Hermione Granger,Lavender BrownShow more"	"Unknown"	"English"	"https://www.goodreads.com/book/show/42844155-harry-potter-and-the-sorcerer-s-stone"
"Twilight"	"The Twilight Saga"	"Stephenie Meyer"	"3.67"	"7,237,264"	"147,466"	"About three things I was absolutely positive.First, Edward was a vampire.Second, there was a part of him - and I didn't know how dominant that part might be - that thirsted for my blood.And third, I was unconditionally and irrevocably in love with him.Deeply seductive and extraordinarily suspenseful,Twilightis a love story with bite.Show more"	"498"	"September 6, 2006"	"Fantasy; Young Adult; Romance; Fiction; Vampires; Paranormal; Paranormal Romance"	"Forks, Washington(United States),Phoenix, Arizona(United States),Washington (state)(United States),Port Angeles, Washington(United States)"	"Edward Cullen,Jacob Black,Laurent,Renee,Bella Swan,Billy Black,Esme Cullen,Alice Cullen,Jasper Hale,Carlisle Cullen,Emmett Cullen,Rosalie Hale,Charlie Swan,Mike Newton,Jessica Stanley,Angela Weber,Tyler Crowley"	"9780316015844"	"English"	"https://www.goodreads.com/book/show/41865.Twilight"
"The Fault in Our Stars"	"None"	"John Green"	"4.12"	"5,662,964"	"187,120"	"Despite the tumor-shrinking medical miracle that has bought her a few years, Hazel has never been anything but terminal, her final chapter inscribed upon diagnosis. But when a gorgeous plot twist named Augustus Waters suddenly appears at Cancer Kid Support Group, Hazel's story is about to be completely rewritten.Insightful, bold, irreverent, and raw, The Fault in Our Stars is award-winning author John Green's most ambitious and heartbreaking work yet, brilliantly exploring the funny, thrilling, and tragic business of being alive and in love.Show more"	"313"	"January 1, 2012"	"Young Adult; Romance; Fiction; Contemporary; Realistic Fiction; Book Club; Coming Of Age"	"Indianapolis, Indiana(United States),Amsterdam(Netherlands)"	"Hazel Grace Lancaster,Augustus Waters,Isaac"	"9780525478812"	"English"	"https://www.goodreads.com/book/show/25856606-the-fault-in-our-stars"
"Divergent"	"Divergent"	"Veronica Roth"	"4.13"	"4,342,957"	"126,886"	"She turns to the future in a world that’s falling apart.The No. 1 New York Times bestseller DIVERGENT – also a major motion picture.For sixteen-year-old Tris, the world changes in a heartbeat when she is forced to make a terrible choice. Turning her back on her family, Tris ventures out, alone, determined to find out where she truly belongs.Shocked by the brutality of her new life, Tris can trust no one. And yet she is drawn to a boy who seems to both threaten and protect her. The hardest choices may yet lie ahead….The first book in the DIVERGENT series that has swept the globe – selling millions of copies world-wide.Show more"	"487"	"February 28, 2012"	"Young Adult; Dystopia; Fantasy; Fiction; Science Fiction; Romance; Adventure"	"Chicago, Illinois(United States)"	"Albert,Drew Leighton (Divergent),Eric (Divergent),Beatrice Prior,Peter,Caleb Prior,Natalie Prior,Molly Atwood,Christina,Jeanine Matthews,Marcus Eaton,Tobias Eaton"	"9780062024039"	"English"	"https://www.goodreads.com/book/show/13335037-divergent"
"The Maze Runner"	"The Maze Runner"	"James Dashner"	"4.05"	"1,664,358"	"70,568"	"There are alternate cover editions for this ASINhereandhere.If you ain’t scared, you ain’t human.When Thomas wakes up in the lift, the only thing he can remember is his name. He’s surrounded by strangers—boys whose memories are also gone.Nice to meet ya, shank. Welcome to the Glade.Outside the towering stone walls that surround the Glade is a limitless, ever-changing maze. It’s the only way out—and no one’s ever made it through alive.Everything is going to change.Then a girl arrives. The first girl ever. And the message she delivers is terrifying.Remember. Survive. Run.Show more"	"384"	"October 6, 2009"	"Young Adult; Dystopia; Science Fiction; Fiction; Fantasy; Adventure; Audiobook"	"Unknown"	"Chuck,Teresa Agnes,Minho,Alby,Gally,Thomas (Maze Runner),Ben,Newt"	"9780385737944"	"English"	"https://www.goodreads.com/book/show/6186357-the-maze-runner"
"Maze Runner: The Scorch Trials: The Official Graphic Novel Prelude"	"None"	"Jackson Lanzing; Collin Kelly; James Dashner"	"4.18"	"74,052"	"257"	"Escaping the Maze was only the beginning.The world thought it had seen the worst after the Sun Flares struck the Earth’s surface, and millions of people were killed. But then an unstoppable illness ravaged the bodies and minds of the remaining survivors. Simply known as the Flare, the disease seemed unstoppable until a cure was discovered, but that relief came at a human cost.Now it's up to Thomas, Teresa and the others, who will discover that while they may have escaped the Maze, they've entered into an experiment more terrifying than anything they could imagine. Explore how the terrifying W.C.K.D. came to be, and how the very first Maze was designed. Discover what it takes to survive in a post-Flare world, against the violent Cranks that have begun to take over humanity, only to learn that the Glade may not be the only Maze W.C.K.D. was running.With over 6.5 million books in print, and an international hit film series, it’s plain to see fans lost themselves in James Dashner’s bestselling series. Featuring an introduction from Dashner himself, this collection of all new short stories reveals the hidden histories of your favorite Gladers, including Aris, Ava Paige, and Mary Cooper before The Scorch Trials hits theaters on September 18.Show more"	"96"	"June 23, 2015"	"Dystopia; Graphic Novels; Young Adult; Fantasy; Fiction; Science Fiction; Comics"	"Unknown"	"Unknown"	"9781608867509"	"English"	"https://www.goodreads.com/book/show/23452896-maze-runner"
"Maze Runner: The Death Cure: The Official Graphic Novel Prelude"	"None"	"Eric Carrasco; Jackson Lanzing; Collin Kelly"	"4.21"	"59,634"	"103"	"An all new, original Maze Runner story set directly before the upcoming third film, The Death Cure.They used to live and die by the Maze—a seemingly endless labyrinth of deathtraps that kept the Gladers prisoner and in fear. But the day Thomas arrived, he motivated them all to push back...and escape.But what they discovered was far worse than any maze—a world scorched by disease and controlled by the oppressive organization, Wicked. Thomas, Aided by a band of rebels, now readies to take the fight right to Wicked’s doorstep in the hope of finding a cure for the plague that’s ravaging mankind.This all-new, authorized graphic novel bridges the gap between the second and third installments (Scorch Trials, The Death Cure)of the hit film franchise,The Maze Runner.Show more"	"96"	"November 14, 2017"	"Dystopia; Science Fiction; Graphic Novels; Fantasy; Fiction; Young Adult; Action"	"Unknown"	"Unknown"	"9781608868261"	"English"	"https://www.goodreads.com/book/show/25987085-maze-runner"
"The Maze Runner: My friend George"	"None"	"Wes Ball"	"4.46"	"20,887"	"16"	"http://www.movietickets.com/editorial..."	"10"	"September 1, 2014"	"Dystopia; Fantasy; Science Fiction; Young Adult; Childrens"	"Unknown"	"Unknown"	"Unknown"	"English"	"https://www.goodreads.com/book/show/23248263-the-maze-runner"
"The Scorch Trials[SCORCH TRIALS][Paperback]"	"None"	"JamesDashner"	"4.28"	"5,725"	"8"	"The Scorch Trials <> Paperback <> JamesDashner <> Ember"	"Paperback"	"September 30, 2011"	"Dystopia"	"Unknown"	"Unknown"	"Unknown"	"English"	"https://www.goodreads.com/book/show/164344762-the-scorch-trials-scorch-trials-paperback"
"Pride and Prejudice"	"None"	"Jane Austen; Anna Quindlen"	"4.29"	"4,739,391"	"143,306"	"Since its immediate success in 1813,Pride and Prejudicehas remained one of the most popular novels in the English language. Jane Austen called this brilliant work "her own darling child" and its vivacious heroine, Elizabeth Bennet, "as delightful a creature as ever appeared in print." The romantic clash between the opinionated Elizabeth and her proud beau, Mr. Darcy, is a splendid performance of civilized sparring. And Jane Austen's radiant wit sparkles as her characters dance a delicate quadrille of flirtation and intrigue, making this book the most superb comedy of manners of Regency England.Alternate cover edition of ISBN 9780679783268Show more"	"279"	"June 22, 2023"	"Classics; Romance; Fiction; Historical Fiction; Historical; Literature; Audiobook"	"Unknown"	"Mr. Bennet,Mrs. Bennet,Jane Bennet,Mary Bennet,Kitty Bennet,Lydia Bennet,Caroline Bingley,Fitzwilliam Darcy,Georgiana Darcy,Lady Catherine de Bourgh,Anne de Bourgh,Colonel Fitzwilliam,Mr. Gardiner,Mrs. Gardiner,Sir William Lucas,Lady Lucas,Charlotte Lucas,Maria Lucas,Charles Bingley,George Wickham,Mr. William Collins,Elizabeth Bennet"	"9781441341709"	"English"	"https://www.goodreads.com/book/show/1885.Pride_and_Prejudice"
"Jane Eyre"	"None"	"Charlotte Brontë; Michael Mason"	"4.16"	"2,299,012"	"78,466"	"Alternate editions can be foundhereandhere.A gothic masterpiece of tempestuous passions and dark secrets, Charlotte Brontë'sJane Eyreis edited with an introduction and notes by Stevie Davis in Penguin Classics.Charlotte Brontë tells the story of orphaned Jane Eyre, who grows up in the home of her heartless aunt, enduring loneliness and cruelty. This troubled childhood strengthens Jane's natural independence and spirit - which prove necessary when she finds employment as a governess to the young ward of Byronic, brooding Mr Rochester. As her feelings for Rochester develop, Jane gradually uncovers Thornfield Hall's terrible secret, forcing her to make a choice. Should she stay with Rochester and live with the consequences, or follow her convictions - even if it means leaving the man she loves? A novel of intense power and intrigue,Jane Eyredazzled readers with its passionate depiction of a woman's search for equality and freedom.Show more"	"532"	"February 4, 2003"	"Classics; Fiction; Romance; Gothic; Historical Fiction; Literature; Historical"	"Thornfield Hall(United Kingdom),England,United Kingdom"	"Jane Eyre,Grace Poole,Blanche Ingram,Adèle Varens,St. John Rivers,Helen Burns,Richard Mason,Diana Rivers,Mary Rivers,Maria Temple,Robert Brocklehurst,Sarah Reed,Georgiana Reed,Eliza Reed,Bessie Lee,Alice Fairfax,Rosamond Oliver,Edward Rochester"	"9780142437209"	"English"	"https://www.goodreads.com/book/show/10210.Jane_Eyre"
"Wuthering Heights"	"None"	"Emily Brontë; Pauline Nestor; Lucasta Miller"	"3.90"	"2,009,213"	"81,968"	"An alternative cover edition for this ISBN can be foundhere.Emily Brontë's only novel, a work of tremendous and far-reaching influence, the Penguin Classics edition of Wuthering Heights is the definitive edition of the text, edited with an introduction by Pauline Nestor. Lockwood, the new tenant of Thrushcross Grange, situated on the bleak Yorkshire moors, is forced to seek shelter one night at Wuthering Heights, the home of his landlord. There he discovers the history of the tempestuous events that took place years before; of the intense relationship between the gypsy foundling Heathcliff and Catherine Earnshaw; and how Catherine, forced to choose between passionate, tortured Heathcliff and gentle, well-bred Edgar Linton, surrendered to the expectations of her class. As Heathcliff's bitterness and vengeance at his betrayal is visited upon the next generation, their innocent heirs must struggle to escape the legacy of the past.Show more"	"359"	"November 1, 2016"	"Classics; Fiction; Romance; Gothic; Historical Fiction; Literature; Historical"	"England,Yorkshire, England"	"Heathcliff,Catherine Earnshaw,Edgar Linton,Isabella Linton,Hindley Earnshaw,Ellen (Nelly) Dean,Mr. Lockwood,Hareton Earnshaw,Catherine Linton,Linton Heathcliff"	"9780141439556"	"English"	"https://www.goodreads.com/book/show/32929156-wuthering-heights"
"Pride and Prejudice"	"None"	"Jane Austen"	"4.29"	"4,739,391"	"143,306"	"Pride and Prejudice has charmed generations of readers for more than two centuries. Jane Austen's much-adapted novel is famed for its witty, spirited heroine, sensational romances, and deft remarks on the triumphs and pitfalls of social convention. Author Jane Austen (1775-1817) was an English novelist whose works of social realism achieved unprecedented critical and popular success, though Austen herself remained an anonymous writer throughout her life."	"400"	"June 22, 2023"	"Classics; Romance; Fiction; Historical Fiction; Historical; Literature; Audiobook"	"Unknown"	"Mr. Bennet,Mrs. Bennet,Jane Bennet,Mary Bennet,Kitty Bennet,Lydia Bennet,Caroline Bingley,Fitzwilliam Darcy,Georgiana Darcy,Lady Catherine de Bourgh,Anne de Bourgh,Colonel Fitzwilliam,Mr. Gardiner,Mrs. Gardiner,Sir William Lucas,Lady Lucas,Charlotte Lucas,Maria Lucas,Charles Bingley,George Wickham,Mr. William Collins,Elizabeth Bennet"	"Unknown"	"English"	"https://www.goodreads.com/book/show/129915654-pride-and-prejudice"
"Little Women"	"Little Women"	"Louisa May Alcott; Regina Barreca; Grzegorz Komerski"	"4.17"	"2,431,487"	"63,450"	"This is an alternate cover edition of ISBN 9780451529305.Generations of readers young and old, male and female, have fallen in love with the March sisters of Louisa May Alcott’s most popular and enduring novel,Little Women. Here are talented tomboy and author-to-be Jo, tragically frail Beth, beautiful Meg, and romantic, spoiled Amy, united in their devotion to each other and their struggles to survive in New England during the Civil War.It is no secret that Alcott basedLittle Womenon her own early life. While her father, the freethinking reformer and abolitionist Bronson Alcott, hobnobbed with such eminent male authors as Emerson, Thoreau, and Hawthorne, Louisa supported herself and her sisters with "woman’s work,” including sewing, doing laundry, and acting as a domestic servant. But she soon discovered she could make more money writing.Little Womenbrought her lasting fame and fortune, and far from being the "girl’s book” her publisher requested, it explores such timeless themes as love and death, war and peace, the conflict between personal ambition and family responsibilities, and the clash of cultures between Europe and America.Show more"	"449"	"April 6, 2004"	"Classics; Fiction; Historical Fiction; Young Adult; Romance; Historical; Literature"	"Concord, Massachusetts(United States),Massachusetts(United States, 1862),London, England,New England(United States)"	"Marmee March,Margaret "Meg" March,Amy March,Theodore "Laurie" Laurence,James Laurence,Professor Bhaer,Mr. March,Hannah Mullet,Aunt March,John Brooke,Josephine "Jo" March,Beth March"	"Unknown"	"English"	"https://www.goodreads.com/book/show/1934.Little_Women"
"Anne of Green Gables"	"Anne of Green Gables"	"L.M. Montgomery; Jennifer Lee Carrell"	"4.33"	"1,101,251"	"47,149"	"This heartwarming story has beckoned generations of readers into the special world of Green Gables, an old-fashioned farm outside a town called Avonlea. Anne Shirley, an eleven-year-old orphan, has arrived in this verdant corner of Prince Edward Island only to discover that the Cuthberts—elderly Matthew and his stern sister, Marilla—want to adopt a boy, not a feisty redheaded girl. But before they can send her back, Anne—who simply must have more scope for her imagination and a real home—wins them over completely. A much-loved classic that explores all the vulnerability, expectations, and dreams of a child growing up,Anne of Green Gablesis also a wonderful portrait of a time, a place, a family… and, most of all, love.WITH AN AFTERWORD BY JENNIFER LEE CARELLShow more"	"320"	"May 6, 2003"	"Classics; Fiction; Young Adult; Historical Fiction; Childrens; Audiobook; Middle Grade"	"Avonlea, Prince Edward Island(Canada),Prince Edward Island(Canada),Canada"	"Matthew Cuthbert,Diana Barry,Gilbert Blythe,Anne Shirley,Marilla Cuthbert,Rachel Lynde,Jane Andrews,Ruby Gillis,Josie Pye,Prissy Andrews,Mr. Phillips,Mrs. Allan,Muriel Stacey"	"9780451528827"	"English"	"https://www.goodreads.com/book/show/8127.Anne_of_Green_Gables"
"The Secret Garden"	"None"	"Frances Hodgson Burnett"	"4.17"	"1,283,836"	"33,921"	"In a house full of sadness and secrets, can young, orphaned Mary find happiness?Mary Lennox, a spoiled, ill-tempered, and unhealthy child, comes to live with her reclusive uncle in Misselthwaite Manor on England’s Yorkshire moors after the death of her parents. There she meets a hearty housekeeper and her spirited brother, a dour gardener, a cheerful robin, and her wilful, hysterical, and sickly cousin, Master Colin, whose wails she hears echoing through the house at night.With the help of the robin, Mary finds the door to a secret garden, neglected and hidden for years. When she decides to restore the garden in secret, the story becomes a charming journey into the places of the heart, where faith restores health, flowers refresh the spirit, and the magic of the garden, coming to life anew, brings health to Colin and happiness to Mary.Show more"	"331"	"September 1, 1998"	"Classics; Fiction; Childrens; Young Adult; Historical Fiction; Middle Grade; Audiobook"	"Yorkshire, England,England,United Kingdom"	"Mary Lennox,Colin Craven,Dickon Sowerby,Martha Sowerby,Ben Weatherstaff,Archibald Craven,Susan Sowerby,Mrs. Medlock,Dr. Craven"	"9780517189603"	"English"	"https://www.goodreads.com/book/show/2998.The_Secret_Garden"
"Charlotte’s Web"	"None"	"E.B. White; Garth Williams; Rosemary Wells"	"4.21"	"2,026,354"	"26,712"	"This beloved book by E. B. White, author ofStuart LittleandThe Trumpet of the Swan, is a classic of children's literature that is "just about perfect." This high-quality paperback features vibrant illustrations colorized by Rosemary Wells!Some Pig. Humble. Radiant. These are the words in Charlotte's Web, high up in Zuckerman's barn. Charlotte's spiderweb tells of her feelings for a little pig named Wilbur, who simply wants a friend. They also express the love of a girl named Fern, who saved Wilbur's life when he was born the runt of his litter.E. B. White's Newbery Honor Book is a tender novel of friendship, love, life, and death that will continue to be enjoyed by generations to come. This edition contains newly color illustrations by Garth Williams, the acclaimed illustrator of E. B. White'sStuart Littleand Laura Ingalls Wilder's Little House series, among many other books.Show more"	"184"	"October 1, 2001"	"Classics; Fiction; Childrens; Fantasy; Young Adult; Middle Grade; Animals"	"The United States of America"	"Fern,Avery,Charlotte,Wilbur,Templeton"	"9780064410939"	"English"	"https://www.goodreads.com/book/show/24178.Charlotte_s_Web"
"The Giving Tree"	"None"	"Shel Silverstein"	"4.39"	"1,225,752"	"24,035"	""Once there was a tree...and she loved a little boy."So begins a story of unforgettable perception, beautifully written and illustrated by the gifted and versatile Shel Silverstein.Every day the boy would come to the tree to eat her apples, swing from her branches, or slide down her trunk...and the tree was happy. But as the boy grew older he began to want more from the tree, and the tree gave and gave and gave.This is a tender story, touched with sadness, aglow with consolation. Shel Silverstein has created a moving parable for readers of all ages that offers an affecting interpretation of the gift of giving and a serene acceptance of another's capacity to love in return.Show more"	"64"	"October 7, 1964"	"Childrens; Classics; Fiction; Picture Books; Poetry; Young Adult; Fantasy"	"Unknown"	"Unknown"	"9780060256654"	"English"	"https://www.goodreads.com/book/show/370493.The_Giving_Tree"
"Green Eggs and Ham"	"None"	"Dr. Seuss"	"4.31"	"840,570"	"12,362"	"“Do you like green eggs and ham?” asks Sam-I-am in this Beginner Book by Dr. Seuss. In a house or with a mouse? In a boat or with a goat? On a train or in a tree? Sam keeps asking persistently. With unmistakable characters and signature rhymes, Dr. Seuss’s beloved favorite has cemented its place as a children’s classic. In this most famous of cumulative tales, the list of places to enjoy green eggs and ham, and friends to enjoy them with, gets longer and longer. Follow Sam-I-am as he insists that this unusual treat is indeed a delectable snack to be savored everywhere and in every way.Originally created by Dr. Seuss, Beginner Books encourage children to read all by themselves, with simple words and illustrations that give clues to their meaning.Show more"	"64"	"January 1, 1988"	"Childrens; Picture Books; Classics; Fiction; Poetry; Fantasy; Humor"	"Unknown"	"Sam-I-Am"	"9780394800165"	"English"	"https://www.goodreads.com/book/show/23772.Green_Eggs_and_Ham"
"To Kill a Mockingbird"	"To Kill a Mockingbird"	"Harper Lee"	"4.26"	"6,803,825"	"131,158"	""Shoot all the bluejays you want, if you can hit 'em, but remember it's a sin to kill a mockingbird."A lawyer's advice to his children as he defends the real mockingbird of Harper Lee's classic novel - a black man charged with the rape of a white girl. Through the young eyes of Scout and Jem Finch, Harper Lee explores with exuberant humour the irrationality of adult attitudes to race and class in the Deep South of the 1930s. The conscience of a town steeped in prejudice, violence and hypocrisy is pricked by the stamina of one man's struggle for justice. But the weight of history will only tolerate so much."To Kill A Mockingbird" became both an instant bestseller and a critical success when it was first published in 1960. It went on to win the Pulitzer Prize in 1961 and was later made into an Academy Award-winning film.Show more"	"323"	"May 23, 2006"	"Classics; Fiction; Historical Fiction; School; Literature; Young Adult; Historical"	"Maycomb, Alabama(United States, 1933),Alabama(United States),The United States of America"	"Scout Finch,Atticus Finch,Jem Finch,Arthur Radley,Mayella Ewell,Alexandra Hancock,Bob Ewell,Calpurnia (To Kill a Mockingbird),Tom Robinson,Miss Maudie Atkinson,Dill Harris"	"9780060935467"	"English"	"https://www.goodreads.com/book/show/2657.To_Kill_a_Mockingbird"
