"Title"	"Series"	"Contributors"	"Average Rating"	"Number of Ratings"	"Number of Reviews"	"Description"	"Number of Pages"	"Publishing Date"	"Genres"	"Setting"	"Characters"	"ISBN"	"Language"	"URL"
"Animal Farm"	"None"	"George Orwell; Russell Baker; C.M. Woodhouse"	"4.01"	"4,474,075"	"129,118"	"Librarian's note: There is an Alternate Cover Edition for this edition of this bookhere.A farm is taken over by its overworked, mistreated animals. With flaming idealism and stirring slogans, they set out to create a paradise of progress, justice, and equality. Thus the stage is set for one of the most telling satiric fables ever penned –a razor-edged fairy tale for grown-ups that records the evolution from revolution against tyranny to a totalitarianism just as terrible.WhenAnimal Farmwas first published, Stalinist Russia was seen as its target. Today it is devastatingly clear that wherever and whenever freedom is attacked, under whatever banner, the cutting clarity and savage comedy of George Orwell’s masterpiece have a meaning and message still ferociously fresh.Show more"	"141"	"April 1, 1996"	"Classics; Fiction; Dystopia; Fantasy; School; Politics; Literature"	"England"	"Snowball,Napoleon,Clover,Boxer,Old Major,Muriel,Squealer,Moses (Animal Farm),Benjamin,Mr. Jones (Animal Farm),Mollie (Animal Farm)"	"9780451526342"	"English"	"https://www.goodreads.com/book/show/170448.Animal_Farm"
"The Metamorphosis"	"None"	"Franz Kafka; Stanley Corngold"	"3.90"	"1,393,039"	"67,194"	"Alternate cover edition of ISBN 0553213695 / 9780553213690"As Gregor Samsa awoke one morning from uneasy dreams he found himself transformed in his bed into a gigantic insect. He was laying on his hard, as it were armor-plated, back and when he lifted his head a little he could see his domelike brown belly divided into stiff arched segments on top of which the bed quilt could hardly keep in position and was about to slide off completely. His numerous legs, which were pitifully thin compared to the rest of his bulk, waved helplessly before his eyes."With it's startling, bizarre, yet surprisingly funny first opening, Kafka begins his masterpiece,The Metamorphosis. It is the story of a young man who, transformed overnight into a giant beetle-like insect, becomes an object of disgrace to his family, an outsider in his own home, a quintessentially alienated man. A harrowing—though absurdly comic—meditation on human feelings of inadequacy, guilt, and isolation,The Metamorphosishas taken its place as one of the most widely read and influential works of twentieth-century fiction. As W.H. Auden wrote, "Kafka is important to us because his predicament is the predicament of modern man."Show more"	"201"	"March 1, 1972"	"Classics; Fiction; Fantasy; Philosophy; Short Stories; Literature; Horror"	"Unknown"	"Gregor Samsa,Grete Samsa,Mr. Samsa,Mrs. Samsa"	"9780553213690"	"English"	"https://www.goodreads.com/book/show/485894.The_Metamorphosis"
"The Stranger"	"None"	"Albert Camus; Matthew  Ward"	"4.03"	"1,368,626"	"73,746"	"Published in 1942 by French author Albert Camus,The Strangerhas long been considered a classic of twentieth-century literature.Le Monderanks it as number one on its "100 Books of the Century" list. Through this story of an ordinary man unwittingly drawn into a senseless murder on a sundrenched Algerian beach, Camus explores what he termed "the nakedness of man faced with the absurd.""	"123"	"March 28, 1989"	"Classics; Fiction; Philosophy; France; Literature; Novels; French Literature"	"Algeria,North Africa,New Mexico(United States, 1881)"	"Meursault,Raymond Sintès,Marie Cardona,Salamano"	"Unknown"	"English"	"https://www.goodreads.com/book/show/49552.The_Stranger"
"White Nights"	"None"	"Fyodor Dostoevsky; Olga Shartse; Fyodor Dostoyevsky"	"4.08"	"319,236"	"44,298"	"White Nights is a short story by Fyodor Dostoevsky that was published in 1848. Set in St. Petersburg, it is the story of a young man fighting his inner restlessness. A light and tender narrative, it delves into the torment and guilt of unrequited love. Both protagonists suffer from a deep sense of alienation that initially brings them together. A blend of romanticism and realism, the story appeals gently to the senses and feelings."	"82"	"January 1, 1848"	"Classics; Fiction; Russian Literature; Romance; Short Stories; Russia; Literature"	"Russia"	"Nastenka"	"Unknown"	"English"	"https://www.goodreads.com/book/show/1772910.White_Nights"
"The Death of Ivan Ilych"	"None"	"Leo Tolstoy; Aylmer Maude; Louise Maude"	"4.14"	"216,464"	"18,657"	"Hailed as one of the world's supreme masterpieces on the subject of death and dying, The Death of Ivan Ilyich is the story of a worldly careerist, a high court judge who has never given the inevitability of his dying so much as a passing thought. But one day, death announces itself to him, and to his shocked surprise, he is brought face to face with his own mortality.How, Tolstoy asks, does an unreflective man confront his one and only moment of truth?This short novel was an artistic culmination of a profound spiritual crisis in Tolstoy's life, a nine-year period following the publication of Anna Karenina during which he wrote not a word of fiction.A thoroughly absorbing, and, at times, terrifying glimpse into the abyss of death, it is also a strong testament to the possibility of finding spiritual salvation.Show more"	"86"	"August 3, 2006"	"Classics; Fiction; Russia; Russian Literature; Literature; Philosophy; Short Stories"	"Unknown"	"Ivan Ilyich Golovin,Praskovya Fëdorovna Golovina,Peter Ivanovich,Gerasim,Lisa Golovina"	"Unknown"	"English"	"https://www.goodreads.com/book/show/18386.The_Death_of_Ivan_Ilych"
"Notes from Underground"	"None"	"Fyodor Dostoevsky; Richard Pevear; Larissa Volokhonsky"	"4.17"	"221,728"	"20,405"	"Dostoevsky’s most revolutionary novel,Notes from Undergroundmarks the dividing line between nineteenth- and twentieth-century fiction, and between the visions of self each century embodied. One of the most remarkable characters in literature, the unnamed narrator is a former official who has defiantly withdrawn into an underground existence. In complete retreat from society, he scrawls a passionate, obsessive, self-contradictory narrative that serves as a devastating attack on social utopianism and an assertion of man’s essentially irrational nature.Richard Pevear and Larissa Volokhonsky, whose Dostoevsky translations have become the standard, give us a brilliantly faithful edition of this classic novel, conveying all the tragedy and tormented comedy of the original.Show more"	"136"	"September 1, 1994"	"Classics; Fiction; Philosophy; Russia; Russian Literature; Literature; Novels"	"Russia,Eastern Europe"	"The underground man"	"9780679734529"	"English"	"https://www.goodreads.com/book/show/49455.Notes_from_Underground"
"The Myth of Sisyphus"	"None"	"Albert Camus; Justin O'Brien"	"4.17"	"90,305"	"7,398"	"Throughout history, some books have changed the world. They have transformed the way we see ourselves—and each other. They have inspired debate, dissent, war and revolution. They have enlightened, outraged, provoked and comforted. They have enriched lives—and destroyed them. Now Penguin brings you the works of the great thinkers, pioneers, radicals and visionaries whose ideas shook civilization and helped make us who we are. Inspired by the myth of a man condemned to ceaselessly push a rock up a mountain and watch it roll back to the valley below,The Myth of Sisyphustransformed twentieth-century philosophy with its impassioned argument for the value of life in a world without religious meaning.Show more"	"192"	"November 26, 2013"	"Philosophy; Nonfiction; Classics; France; Essays; French Literature; Literature"	"Unknown"	"Unknown"	"9780141182001"	"English"	"https://www.goodreads.com/book/show/91950.The_Myth_of_Sisyphus"
"Existentialism is a Humanism"	"None"	"Jean-Paul Sartre; Arlette Elkaïm-Sartre; Annie Cohen-Solal"	"3.98"	"45,640"	"2,719"	"It was to correct common misconceptions about his thought that Jean-Paul Sartre, the most dominent European intellectual of the post-World War II decades, accepted an invitation to speak on October 29, 1945, at the Club Maintenant in Paris. The unstated objective of his lecture (“Existentialism Is a Humanism”) was to expound his philosophy as a form of “existentialism,” a term much bandied about at the time. Sartre asserted that existentialism was essentially a doctrine for philosophers, though, ironically, he was about to make it accessible to a general audience. The published text of his lecture quickly became one of the bibles of existentialism and made Sartre an international celebrity.The idea of freedom occupies the center of Sartre’s doctrine. Man, born into an empty, godless universe, is nothing to begin with. He creates his essence—his self, his being—through the choices he freely makes (“existence precedes essence”). Were it not for the contingency of his death, he would never end. Choosing to be this or that is to affirm the value of what we choose. In choosing, therefore, we commit not only ourselves but all of mankind.This book presents a new English translation of Sartre’s 1945 lecture and his analysis of Camus’sThe Stranger, along with a discussion of these works by acclaimed Sartre biographer Annie Cohen-Solal. This edition is a translation of the 1996 French edition, which includes Arlette Elkaïm-Sartre’s introduction and a Q&A with Sartre about his lecture.Show more"	"122"	"July 24, 2007"	"Philosophy; Nonfiction; Classics; France; Essays; French Literature; Theory"	"Unknown"	"Unknown"	"9780300115468"	"English"	"https://www.goodreads.com/book/show/51985.Existentialism_is_a_Humanism"
"Fear and Trembling"	"None"	"Søren Kierkegaard; Alastair Hannay"	"4.00"	"30,943"	"2,454"	"Soren Kierkegaard was a Danish philosopher, theologian, and religious author interested in human psychology. He is regarded as a leading pioneer of existentialism and one of the greatest philosophers of the 19th Century.InFear and Trembling, Kierkegaard wanted to understand the anxiety that must have been present in Abraham when God commanded him to offer his son as a human sacrifice. Abraham had a choice to complete the task or to forget it. He resigned himself to the loss of his son, acting according to his faith. In other words, one must be willing to give up all his or her earthly possessions in infinite resignation and must also be willing to give up whatever it is that he or she loves more than God. Abraham had passed the test -- his love for God proved greater than anything else in him. And because a good and just Creator would not want a father to kill his son, God intervened at the last moment to prevent the sacrifice.Show more"	"152"	"May 30, 2006"	"Philosophy; Nonfiction; Religion; Classics; Theology; Christianity; Psychology"	"Unknown"	"Unknown"	"9780143037576"	"English"	"https://www.goodreads.com/book/show/24965.Fear_and_Trembling"
"On the Genealogy of Morals"	"None"	"Friedrich Nietzsche; Douglas Smith"	"4.12"	"35,099"	"1,777"	"On the Genealogy of Morals(1887) is a book about the history of ethics and about interpretation. Nietzsche rewrites the former as a history of cruelty, exposing the central values of the Judaeo-Christian and liberal traditions - compassion, equality, justice - as the product of a brutal process of conditioning designed to domesticate the animal vitality of earlier cultures. The result is a book which raises profoundly disquieting issues about the violence of both ethics and interpretation. Nietzsche questions moral certainties by showing that religion and science have no claim to absolute truth, before turning on his own arguments in order to call their very presuppositions into question. The Genealogy is the most sustained of Nietzsche's later works and offers one of the fullest expressions of his characteristic concerns. This edition places his ideas within the cultural context of his own time and stresses the relevance of his work for a contemporary audience.Show more"	"208"	"February 25, 1999"	"Philosophy; Nonfiction; Classics; Psychology; German Literature; History; Religion"	"Unknown"	"Unknown"	"9780192836175"	"English"	"https://www.goodreads.com/book/show/80449.On_the_Genealogy_of_Morals"
"J.R.R. Tolkien 4-Book Boxed Set: The Hobbit and The Lord of the Rings"	"Middle-earth"	"J.R.R. Tolkien"	"4.62"	"143,264"	"2,459"	"These magical adaptations became instant classics when they were first broadcast on BBC Radio 4, and continue to delight today. Tolkien's epic tale of Middle-earth has all the classic ingredients of fantasy and adventure: dwarves, elves, goblins and trolls, a terrifying dragon, a great wizard, a fearsome evil, a perilous quest and a dramatic climax. With an all-star cast including Ian Holm, Michael Hordern, Robert Stephens, John le Mesurier and Bill Nighy, these enchanting dramatisations are a must for all Tolkien fans. 'For those who find the books too long-winded and the films too noisy, this is the perfect way to assimilate the myth and magic of Middle-earth' - Guardian.19 CDs. 17 hrs 30 mins.Show more"	"1728"	"September 25, 2012"	"Fantasy; Fiction; Classics; Adventure; Science Fiction Fantasy; Epic Fantasy; High Fantasy"	"Middle Earth"	"Frodo Baggins,Gandalf,Bilbo Baggins,Gollum"	"9780345538376"	"English"	"https://www.goodreads.com/book/show/30.J_R_R_Tolkien_4_Book_Boxed_Set"
"The Chronicles of Narnia"	"The Chronicles of Narnia (Publication Order)"	"C.S. Lewis; Pauline Baynes"	"4.28"	"703,129"	"13,432"	"Librarian note:An alternate cover for this edition can be found here:2005.Journeys to the end of the world, fantastic creatures, and epic battles between good and evil—what more could any reader ask for in one book? The book that has it all isThe Lion, the Witch and the Wardrobe, written in 1949 by Clive Staples Lewis. But Lewis did not stop there. Six more books followed, and together they became known asThe Chronicles of Narnia.For the past fifty years,The Chronicles of Narniahave transcended the fantasy genre to become part of the canon of classic literature. Each of the seven books is a masterpiece, drawing the reader into a land where magic meets reality, and the result is a fictional world whose scope has fascinated generations.This edition presents all seven books—unabridged—in one impressive volume. The books are presented here in chronlogical order, each chapter graced with an illustration by the original artist, Pauline Baynes. Deceptively simple and direct,The Chronicles of Narniacontinue to captivate fans with adventures, characters, and truths that speak to readers of all ages, even fifty years after they were first published.Show more"	"767"	"January 1, 2014"	"Fantasy; Classics; Fiction; Young Adult; Childrens; Christian; Adventure"	"London, England"	"Polly,Aslan,Lucy Pevensie,Edmund Pevensie,Eustace Scrubb,Prince Caspian,Jill Pole,Prince Rilian,Puddleglum,Trumpkin,Jewel,Aravis,Mr. Tumnus,Puzzle,King Tirian,Digory Kirke,Peter Pevensie,Susan Pevensie,Reepicheep,Jadis,Bacchus (god),Mr. & Mrs. Beaver,Andrew Kirke,Shasta,Silenus,Nikabrik,King Miraz,Dr. Cornelius,Trufflehunter,Shift"	"9780066238500"	"English"	"https://www.goodreads.com/book/show/11127.The_Chronicles_of_Narnia"
"Harry Potter and the Deathly Hallows"	"Harry Potter"	"J.K. Rowling; Mary GrandPré"	"4.62"	"4,072,267"	"98,065"	"It's no longer safe for Harry at Hogwarts, so he and his best friends, Ron and Hermione, are on the run. Professor Dumbledore has given them clues about what they need to do to defeat the dark wizard, Lord Voldemort, once and for all, but it's up to them to figure out what these hints and suggestions really mean. Their cross-country odyssey has them searching desperately for the answers, while evading capture or death at every turn. At the same time, their friendship, fortitude, and sense of right and wrong are tested in ways they never could have imagined. The ultimate battle between good and evil that closes out this final chapter of the epic series takes place where Harry's Wizarding life began: at Hogwarts. The satisfying conclusion offers shocking last-minute twists, incredible acts of courage, powerful new forms of magic, and the resolution of many mysteries. Above all, this intense, cathartic book serves as a clear statement of the message at the heart of the Harry Potter series: that choice matters much more than destiny, and that love will always triumph over death.Series Information: Eleven-year-old Harry Potter is an orphan living with his cruel aunt and uncle when he makes a discovery that will change his life forever: he is a wizard. He is whisked away to the mystical Hogwarts School of Witchcraft and Wizardry to learn magical skills, from potions to spells to flying on broomsticks. But an evil power is rising, the same one that threatened to destroy the entire world when Harry was only a baby. As Harry learns the truth about his family, his childhood, and his mysterious lightning-bolt-shaped scar, he finds unforgettable friendship, a loving surrogate family, and the courage to face the darkest force ever to menace the wizarding world. These charming and engrossing books bring an intensely detailed and captivating world to life and are perfect for enjoying individually or reading aloud.Show more"	"784"	"July 21, 2007"	"Fantasy; Young Adult; Fiction; Harry Potter; Magic; Audiobook; Childrens"	"London, England,Hogwarts School of Witchcraft and Wizardry(United Kingdom),Pagford(United Kingdom)"	"Sirius Black,Ron Weasley,Petunia Dursley,Vernon Dursley,Dudley Dursley,Severus Snape,Rubeus Hagrid,Lord Voldemort,Minerva McGonagall,Neville Longbottom,Fred Weasley,George Weasley,Percy Weasley,Ginny Weasley,Colin Creevey,Filius Flitwick,Lucius Malfoy,Pomona Sprout,Arthur Weasley,Molly Weasley,Cho Chang,Remus Lupin,Sybil Trelawney,Peter Pettigrew,Oliver Wood,Fleur Delacour,Viktor Krum,Bellatrix Lestrange,Alastor Moody,Bill Weasley,Luna Lovegood,Nymphadora Tonks,Dolores Umbridge,Dobby,Kingsley Shacklebolt,Padma Patil,Parvati Patil,Kreacher,Narcissa Malfoy,Horace Slughorn,Rufus Scrimgeour,Dean Thomas,Aberforth Dumbledore,James Potter,Lily Potter,Xenophilius Lovegood,Seamus Finnigan,Garrick Ollivander,Katie Bell,Griphook,James Sirius Potter,Teddy Lupin,Hugo Weasley,Draco Malfoy,Albus Dumbledore,Lily Luna Potter,Albus Severus Potter,Rose Weasley,Harry Potter,Hermione Granger,Lavender BrownShow more"	"9780545010221"	"English"	"https://www.goodreads.com/book/show/58613224-harry-potter-and-the-deathly-hallows"
"Eclipse"	"The Twilight Saga"	"Stephenie Meyer"	"3.74"	"1,977,184"	"50,322"	""BELLA?"Edward's soft voice came from behind me. I turned to see him spring lightly up the porch steps, his hair windblown from running. He pulled me into his arms at once, just like he had in the parking lot, and kissed me again.This kiss frightened me. There was too much tension, too strong an edge to the way his lips crushed mine - like he was afraid we had only so much time left to us.As Seattle is ravaged by a string of mysterious killings and a malicious vampire continues her quest for revenge, Bella once again finds herself surrounded by danger. In the midst of it all, she is forced to choose between her love for Edward and her friendship with Jacob - knowing that her decision has the potential to ignite the ageless struggle between vampire and werewolf. With her graduation quickly approaching, Bella has one more decision to make: life or death. But which is which?READERS CAPTIVATED BYTwilightANDNew Moonwill eagerly devourEclipse, the much-anticipated third book in Stephenie Meyer's riveting vampire love saga.Show more"	"629"	"August 7, 2007"	"Fantasy; Young Adult; Romance; Vampires; Fiction; Paranormal; Paranormal Romance"	"Forks, Washington(United States),Washington (state)(United States),La Push, Washington(United States)"	"Edward Cullen,Jacob Black,Bella Swan,Billy Black,Esme Cullen,Alice Cullen,Jasper Hale,Carlisle Cullen,Emmett Cullen,Rosalie Hale,Charlie Swan,Embry Call,Sam Uley,Quil Ateara,Bree Tanner"	"9780316160209"	"Italian"	"https://www.goodreads.com/book/show/428263.Eclipse"
"Fifty Shades Darker"	"Fifty Shades"	"E.L. James"	"3.83"	"970,004"	"31,589"	"Daunted by the singular sexual tastes and dark secrets of the beautiful, tormented young entrepreneur Christian Grey, Anastasia Steele has broken off their relationship to start a new career with a Seattle publishing house. But desire for Christian still dominates her every waking thought, and when he proposes a new arrangement, Anastasia cannot resist. They rekindle their searing sensual affair, and Anastasia learns more about the harrowing past of her damaged, driven, and demanding Fifty Shades. While Christian wrestles with his inner demons, Anastasia must confront her anger and envy of the women who came before her and make the most important decision of her life. Erotic, sparkling and suspenseful,Fifty Shades Darkeris the irresistibly addictive second part of the Fifty Shades trilogy.Show more"	"532"	"September 16, 2011"	"Romance; Fiction; Erotica; BDSM; Adult; Contemporary; Contemporary Romance"	"Seattle, Washington(United States)"	"Anastasia Steele,Christian Grey"	"9781612130583"	"English"	"https://www.goodreads.com/book/show/11857408-fifty-shades-darker"
"Breaking Dawn"	"The Twilight Saga"	"Stephenie Meyer"	"3.76"	"1,858,315"	"58,139"	""Don't be afraid," I murmured. "We belong together."I was abruptly overwhelmed by the truth of my own words.This moment was so perfect, so right, there was no way to doubt it.His arms wrapped around me,holding me against him....It felt like every nerve ending in my body was a live wire."Forever," he agreed.WHEN YOU LOVED THE ONE WHO WAS KILLING YOU, IT LEFT YOU NO OPTIONS. How could you run, how could you fight, when doing so would hurt that beloved one? If your life was all you had to give, how could you not give it? If it was someone you truly loved?TO BE IRREVOCABLY IN LOVE WITH A VAMPIRE is both fantasy and nightmare woven into a dangerously heightened reality for Bella Swan. Pulled in one direction by her intense passion for Edward Cullen, and in another by her profound connection to werewolf Jacob Black, a tumultuous year of temptation, loss, and strife have led her to the ultimate turning point. Her imminent choice to either join the dark but seductive world of immortals or to pursue a fully human life has become the thread from which the fates of two tribes hangs.NOW THAT BELLA HAS MADE HER DECISION, a startling chain of unprecedented events is about to unfold with potentially devastating, and unfathomable, consequences. Just when the frayed strands of Bella's life - first discovered inTwilight, then scattered and torn inNew MoonandEclipse- seem ready to heal and knit together, could they be destroyed... forever?THE ASTONISHING, BREATHLESSLY anticipated conclusion to the Twilight Saga,Breaking Dawnilluminates the secrets and mysteries of this spellbinding romantic epic that has entranced millions.Show more"	"756"	"August 2, 2008"	"Fantasy; Young Adult; Romance; Vampires; Fiction; Paranormal; Paranormal Romance"	"Forks, Washington(United States),Washington (state)(United States)"	"Edward Cullen,Jacob Black,Bella Swan,Esme Cullen,Alice Cullen,Jasper Hale,Emmett Cullen,Rosalie Hale,Charlie Swan,Renesmee Cullen,Seth Clearwater,Leah Clearwater"	"9780316067928"	"English"	"https://www.goodreads.com/book/show/1162543.Breaking_Dawn"
"Fifty Shades Freed"	"Fifty Shades"	"E.L. James"	"3.83"	"909,124"	"28,410"	"When unworldly student Anastasia Steele first encountered the driven and dazzling young entrepreneur Christian Grey it sparked a sensual affair that changed both of their lives irrevocably. Shocked, intrigued, and, ultimately, repelled by Christian’s singular erotic tastes, Ana demands a deeper commitment. Determined to keep her, Christian agrees.Now, Ana and Christian have it all—love, passion, intimacy, wealth, and a world of possibilities for their future. But Ana knows that loving her Fifty Shades will not be easy, and that being together will pose challenges that neither of them would anticipate. Ana must somehow learn to share Christian’s opulent lifestyle without sacrificing her own identity. And Christian must overcome his compulsion to control as he wrestles with the demons of a tormented past.Just when it seems that their strength together will eclipse any obstacle, misfortune, malice, and fate conspire to make Ana’s deepest fears turn to reality.This book is intended for mature audiences.Show more"	"579"	"January 1, 2013"	"Romance; Erotica; Fiction; BDSM; Adult; Contemporary; Contemporary Romance"	"Seattle, Washington(United States)"	"Anastasia Steele,Christian Grey"	"9780345803504"	"English"	"https://www.goodreads.com/book/show/13536860-fifty-shades-freed"
