"Title"	"Series"	"Contributors"	"Average Rating"	"Number of Ratings"	"Number of Reviews"	"Description"	"Number of Pages"	"Publishing Date"	"Genres"	"Setting"	"Characters"	"ISBN"	"Language"	"URL"
"Diary of a Wimpy Kid"	"Diary of a Wimpy Kid"	"Jeff Kinney"	"3.98"	"766,188"	"23,595"	"Being a kid can really stink. And no one knows this better than Greg. He finds himself thrust into middle school, where undersized weaklings share the hallways with kids who are taller, meaner, and already shaving. Greg is happy to have Rowley Jefferson, his sidekick, along for the ride. But when Rowley's star starts to rise, Greg tries to use his best friend's newfound popularity to his own advantage, kicking off a chain of events that will test their friendship in hilarious fashion.The hazards of growing up before you're ready are uniquely revealed through words and drawings as Greg records them in his diary. But as Greg says: “Just don’t expect me to be all “Dear Diary” this and “Dear Diary” that.”Luckily for us, what Greg Heffley says he won’t do and what he actually does are two very different things.Show more"	"226"	"April 1, 2007"	"Fiction; Childrens; Humor; Middle Grade; Young Adult; Graphic Novels; Realistic Fiction"	"Unknown"	"Greg Heffley,Rodrick Heffley,Manny Heffley,Rowley,Rodrick Heffley,Manny Heffley,Rowley"	"9780810993136"	"English"	"https://www.goodreads.com/book/show/389627.Diary_of_a_Wimpy_Kid"
"Dog Man"	"Dog Man"	"Dav Pilkey"	"4.11"	"95,326"	"3,125"	"From worldwide bestselling author and artistDav PilkeycomesDog Man,the canine cop who's part dog, part man, andAll Hero!Get ready for Action, Suspense, Romance... andLaffs!George and Harold have created a new breed of justice. When Greg the police dog and his cop companion are injured on the job, a life-saving surgery changes the course of history, andDog Manis born. With the head of a dog and the body of a human, this heroic hound digs into deception, claws after crooks, rolls over robbers, and scampers after squirrels. Will he be able to resist the call of the wild to answer the call of duty?Dav Pilkey'swildly popular'Dog Man' Seriesappeals to readers of all ages and explores universally positive themes, including empathy, kindness, persistence, and the importance of being true to one's self. This new series may use conventional spelling, but it is still full of all the same humor and fun of George and Harold's previous graphic novels!Age Rating: 6-8+ / Grades 2-3+ / Lexile GN390LEdition MSRP: $9⁹⁹ US / $12⁹⁹ CAN / £12⁹⁹ UK(ISBN 978-0-545-58160-8)Printed in ChinaShow more"	"231"	"August 30, 2016"	"Graphic Novels; Childrens; Comics; Humor; Middle Grade; Fiction; Fantasy"	"Unknown"	"Unknown"	"9780545581608"	"English"	"https://www.goodreads.com/book/show/28691896-dog-man"
"The Cat in the Hat"	"The Cat in the Hat"	"Dr. Seuss"	"4.19"	"582,392"	"7,680"	"Have a ball with Dr. Seuss and the Cat in the Hat in this classic picture book...but don't forget to clean up your mess!Then he said That is that.And then he was goneWith a tip of his hat.A dreary day turns into a wild romp when this beloved story introduces readers to theCat in the Hatand his troublemaking friends,Thing 1andThing 2– And don't forgetFish! A favorite among kids, parents and teachers, this story uses simple words and basic rhyme to encourage and delight beginning readers.Originally created byDr. Seusshimself,Beginner Booksare fun, funny, and easy to read. These unjacketed hardcover early readers encourage children to read all on their own, using simple words and illustrations. Smaller than the classic large format Seuss picture books likeThe LoraxandOh, The Places You'll Go!,these portable packages are perfect for practicing readers ages 3-7, and lucky parents too!Show more"	"61"	"January 1, 1985"	"Childrens; Picture Books; Classics; Fiction; Poetry; Fantasy; Humor"	"Unknown"	"The Cat in the Hat"	"9780394800011"	"English"	"https://www.goodreads.com/book/show/233093.The_Cat_in_the_Hat"
"The Very Hungry Caterpillar"	"Eric Carle's Very Series"	"Eric Carle"	"4.34"	"544,213"	"11,630"	"THE all-time classic story, from generation to generation, sold somewhere in the world every 30 seconds! Have you shared it with a child or grandchild in your life?One sunny Sunday, the caterpillar was hatched out of a tiny egg. He was very hungry. On Monday, he ate through one apple; on Tuesday, he ate through three plums--and still he was hungry. When full at last, he made a cocoon around himself and went to sleep, to wake up a few weeks later wonderfully transformed into a butterfly!The brilliantly innovative Eric Carle has dramatized the story of one of Nature's commonest yet loveliest marvels, the metamorphosis of the butterfly. This audiobook will delight as well as instruct the very youngest listener.Show more"	"26"	"January 1, 1994"	"Picture Books; Childrens; Fiction; Classics; Animals; Food; Counting"	"Unknown"	"Unknown"	"9780241003008"	"English"	"https://www.goodreads.com/book/show/4948.The_Very_Hungry_Caterpillar"
"Brown Bear, Brown Bear, What Do You See?"	"Bill Martin's Bears"	"Bill Martin Jr.; Eric Carle"	"4.27"	"190,542"	"4,661"	"A big happy frog, a plump purple cat, a handsome blue horse, and a soft yellow duck--all parade across the pages of this delightful book. Children will immediately respond to Eric Carle's flat, boldly colored collages. Combined with Bill Martin's singsong text, they create unforgettable images of these endearing animals."	"24"	"September 15, 1996"	"Picture Books; Childrens; Animals; Fiction; Classics; Storytime; Poetry"	"Unknown"	"Unknown"	"9780805047905"	"English"	"https://www.goodreads.com/book/show/759611.Brown_Bear_Brown_Bear_What_Do_You_See_"
"The Rainbow Fish"	"Rainbow Fish"	"Marcus Pfister"	"4.21"	"162,812"	"3,873"	"The Rainbow Fishis an international bestseller and a modern classic. Eye-catching foilstamping, glittering on every page, offers instant child-appeal, but it is the universal message at the heart of this simple story about a beautiful fish, who learns to make friends by sharing his most prized possessions, that gives the book its lasting value."	"32"	"January 1, 1992"	"Picture Books; Childrens; Fiction; Animals; Friendship; Classics; Fantasy"	"Unknown"	"Rainbow Fish"	"9781558580091"	"English"	"https://www.goodreads.com/book/show/766020.The_Rainbow_Fish"
"Chicka Chicka Boom Boom"	"Chicka Chicka"	"Bill Martin Jr.; John Archambault; Lois Ehlert"	"4.26"	"170,374"	"5,256"	"The 26 characters in this rhythmic, rhyming baby book are a lowercase alphabet with attitude. "A told b, and b told c, 'I'll meet you at the top of the coconut tree'"--which probably seemed like a good idea until the other 23 members of the gang decided to follow suit. The palm tree standing straight and tall on the first page begins to groan and bend under its alphabetical burden. First the coconuts fall off, then ("Chicka chicka... BOOM! BOOM!") all the letters also end up in a big heap underneath."	"32"	"August 1, 2000"	"Picture Books; Childrens; Fiction; Poetry; Classics; Storytime; Kids"	"Unknown"	"Unknown"	"9780689835681"	"English"	"https://www.goodreads.com/book/show/293595.Chicka_Chicka_Boom_Boom"
"Wuthering Heights"	"None"	"Emily Brontë; Richard J. Dunn; Charlotte Brontë"	"3.90"	"2,009,213"	"81,968"	"You can find the redesigned cover of this editionHERE.At the centre of this novel is the passionate love between Catherine Earnshaw and Heathcliff - recounted with such emotional intensity that a plain tale of the Yorkshire moors acquires the depth and simplicity of ancient tragedy.This best-selling Norton Critical Edition is based on the 1847 first edition of the novel. For the Fourth Edition, the editor has collated the 1847 text with several modern editions and has corrected a number of variants, including accidentals. The text is accompanied by entirely new explanatory annotations.New to the fourth Edition are twelve of Emily Bronte's letters regarding the publication of the 1847 edition of Wuthering Heights as well as the evolution of the 1850 edition, prose and poetry selections by the author, four reviews of the novel, and poetry selections by the author, four reviews of the novel, and Edward Chitham's insightful and informative chronology of the creative process behind the beloved work.Five major critical interpretations of Wuthering Heights are included, three of them new to the Fourth Edition. A Stuart Daley considers the importance of chronology in the novel. J. Hillis Miller examines Wuthering Heights's problems of genre and critical reputation. Sandra M. Gilbert assesses the role of Victorian Christianity plays in the novel, while Martha Nussbaum traces the novel's romanticism. Finally, Lin Haire-Sargeant scrutinizes the role of Heathcliff in film adaptations of Wuthering Heights.A Chronology and updated Selected Bibliography are also included.Show more"	"464"	"January 1, 2002"	"Classics; Fiction; Romance; Gothic; Historical Fiction; Literature; Historical"	"England,Yorkshire, England"	"Heathcliff,Catherine Earnshaw,Edgar Linton,Isabella Linton,Hindley Earnshaw,Ellen (Nelly) Dean,Mr. Lockwood,Hareton Earnshaw,Catherine Linton,Linton Heathcliff"	"Unknown"	"English"	"https://www.goodreads.com/book/show/6185.Wuthering_Heights"
"Sense and Sensibility"	"None"	"Jane Austen; Ros Ballaster; Джейн Остин"	"4.09"	"1,285,192"	"34,097"	"Alternate cover edition of ISBN 9780141439662'The more I know of the world, the more am I convinced that I shall never see a man whom I can really love. I require so much!'Marianne Dashwood wears her heart on her sleeve, and when she falls in love with the dashing but unsuitable John Willoughby she ignores her sister Elinor's warning that her impulsive behaviour leaves her open to gossip and innuendo. Meanwhile Elinor, always sensitive to social convention, is struggling to conceal her own romantic disappointment, even from those closest to her. Through their parallel experience of love—and its threatened loss—the sisters learn that sense must mix with sensibility if they are to find personal happiness in a society where status and money govern the rules of love.This edition includes explanatory notes, textual variants between the first and second editions, and Tony Tanner's introduction to the original Penguin Classic edition.Show more"	"409"	"April 29, 2003"	"Classics; Fiction; Romance; Historical Fiction; Literature; Audiobook; Historical"	"England,United Kingdom,Sussex, England,London, England,Devon, England"	"Elinor Dashwood,Marianne Dashwood,Mrs. Jennings,Edward Ferrars,Colonel Brandon,Lady Middleton,Sir John Middleton,John Dashwood,Fanny Dashwood,Mrs. Dashwood,John Willoughby,Margaret Dashwood,Robert Ferrars,Anne Steele,Lucy Steele"	"9780141439662"	"English"	"https://www.goodreads.com/book/show/14935.Sense_and_Sensibility"
"Austen: Persuasion"	"None"	"Judy Simons"	"4.49"	"13,749"	"55"	"A study guide for the novel Persuasion."	"96"	"December 1, 1987"	"Classics; Fiction; Romance; Historical; Historical Fiction; Literature; Classic Literature"	"Unknown"	"Unknown"	"9780333446065"	"English"	"https://www.goodreads.com/book/show/1967231.Austen"
"The Sense and Sensibility Screenplay and Diaries: Bringing Jane Austen's Novel to Film"	"None"	"Emma Thompson; Jane Austen; Clive Coote"	"4.46"	"13,471"	"329"	"The actress presents her screenplay for the film version of Austen's classic novel, along with her personal record of the making of the film"	"288"	"January 1, 1996"	"Nonfiction; Classics; Film; Memoir; Plays; Romance; Drama"	"Unknown"	"Unknown"	"9781557042927"	"English"	"https://www.goodreads.com/book/show/37557.The_Sense_and_Sensibility_Screenplay_and_Diaries"
"Pride and Prejudice"	"None"	"Beth Johnson"	"4.61"	"3,963"	"7"	"The five Bennet girls need husbands.And now a rich, handsome bachelor has moved in next door. He falls in love with Jane, the oldest Bennet girl. Everything goes well—for a while. Then the handsome bachelor’s proud best friend, Mr. Darcy, ruins everything.Elizabeth Bennet has never hated anyone as much as she hates Mr. Darcy. How could she ever forgive the man who has ruined her sister’s happiness? She knows everything she needs to know about him. He is proud, hateful, conceited, and horrid—and he wants to marry her.Elizabeth and Darcy’s memorable, witty battle of hearts and minds has made Pride and Prejudice a readers’ favorite for almost two hundred years.Readability Note: This Townsend Library Classic has been carefully edited for clarity and readability.Source: townsendpress.comShow more"	"406"	"May 31, 2007"	"Classics; Romance; Fiction; Classic Literature; Drama"	"Unknown"	"Unknown"	"9781591940678"	"English"	"https://www.goodreads.com/book/show/2875649-pride-and-prejudice"
"Little Women"	"None"	"Deanna McFadden; Lucy Corvino; Louisa May Alcott"	"4.35"	"14,167"	"183"	"While their chaplain father is away in the American Civil War, mother "Marmee" watches the four March sisters grow up and strive for their dreams. Meg is the capable eldest, tomboy Jo writes (like the author), Beth longs for a piano, Amy loves pretty things. Kindly neighbor Mr Laurence contributes, and his grandson "Teddy" Theodore becomes part of the family too."	"160"	"March 1, 2005"	"Classics; Fiction; Historical Fiction; Young Adult; Childrens; Audiobook; American"	"Unknown"	"Unknown"	"9781402712364"	"English"	"https://www.goodreads.com/book/show/597362.Little_Women"
"Anne of Green Gables"	"None"	"Jennifer Dussling; L.M. Montgomery; Lydia Halverson"	"4.56"	"12,677"	"106"	"Anne is a young orphan who finally finds a home at Green Gables, but it's not exactly smooth sailing. Anne always seems to find herself getting into scrapes! This easy-to-read adaptation ofL.M. Montgomery's classic is guaranteed to hook beginning readers not yet ready to tackle the original."	"48"	"March 19, 2001"	"Classics; Fiction; Childrens; Young Adult; Historical Fiction; Literature; Middle Grade"	"Unknown"	"Unknown"	"9780448424590"	"English"	"https://www.goodreads.com/book/show/8129.Anne_of_Green_Gables"
"The Secret Garden"	"None"	"Martha Hailey DuBose; Frances Hodgson Burnett; Lucy Corvino"	"4.39"	"9,811"	"188"	"Following Sterlings spectacularly successful launch of its childrens classic novels (240,000 books in print to date),comes a dazzling new series: Classic Starts . The stories are abridged; the quality is complete. Classic Starts treats the worlds beloved tales (and children) with the respect they deserve--all at an incomparable price.The discovery of a neglected garden transforms the life of a sullen and unloved little girl-and everyone around her, too. When the newly orphaned Mary Lennox leaves her native India and arrives at her uncles mansion in Yorkshire, everything seems strange to her. Then Mary hears of a mysterious garden where no one has set foot in 10 years. With the help of some new friends, she plans to uncover its secrets...and make it blossom once again.Show more"	"160"	"March 1, 2005"	"Classics; Fiction; Childrens; Young Adult; Historical Fiction; Fantasy; Middle Grade"	"Unknown"	"Unknown"	"9781402713194"	"English"	"https://www.goodreads.com/book/show/3004.The_Secret_Garden"
"Charlotte's Web and Other Illustrated Classics"	"None"	"E.B. White; Garth Williams; Fred Marcellino"	"4.47"	"16,506"	"54"	"For more than half a century, E. B. White's novel Charlotte's Web has charmed readers with its account of Charlotte, the resourceful spider, and the love and friendship she brings to her farmyard friends. Charlotte's Web and Other Illustrated Classics collects in a single volume all of E. B. White's classics for young readers, including Stuart Little, the story of an adventurous mouse boy born to human parents, and The Trumpet of the Swan, about Louis, the voiceless swan, who plays the trumpet to express himself. This volume features the classic illustrations of Garth Williams and Fred Marcelino.Charlotte's Web and Other Illustrated Classics is one of Barnes & Noble's leatherbound classic editions. Each volume features authoritative texts by the world's greatest authors, in exquistiely designed bonded-leather bindings with distinctive gilt edging and an attractive silk-ribbon bookmark. Decorative, durable, and collectible, these books offer hours of pleasure to readers young and old, and are an indispensible cornerstone for every home library.Show more"	"605"	"January 25, 2013"	"Classics; Fiction; Childrens; Young Adult; Fantasy; Animals; Middle Grade"	"Unknown"	"Unknown"	"9781435145979"	"English"	"https://www.goodreads.com/book/show/18298747-charlotte-s-web-and-other-illustrated-classics"
"Harper Lee's To Kill a Mockingbird"	"None"	"Christopher Sergel; Harper Lee"	"4.51"	"23,773"	"169"	"The "Heinemann Plays" series offers contemporary drama and classic plays in classroom editions. Many have large casts and an equal mix of boy and girl parts. This play discusses racial tension in the heart of the American South."	"128"	"January 17, 1995"	"Classics; Fiction; Plays; Historical Fiction; Drama; Audiobook; Theatre"	"Unknown"	"Unknown"	"9780435233112"	"English"	"https://www.goodreads.com/book/show/87783.Harper_Lee_s_To_Kill_a_Mockingbird"
"The Giving Tree"	"None"	"Shel Silverstein"	"4.39"	"1,225,752"	"24,035"	""Once there was a tree...and she loved a little boy."So begins a story of unforgettable perception, beautifully written and illustrated by the gifted and versatile Shel Silverstein.Every day the boy would come to the tree to eat her apples, swing from her branches, or slide down her trunk...and the tree was happy. But as the boy grew older he began to want more from the tree, and the tree gave and gave and gave.This is a tender story, touched with sadness, aglow with consolation. Shel Silverstein has created a moving parable for readers of all ages that offers an affecting interpretation of the gift of giving and a serene acceptance of another's capacity to love in return.Show more"	"64"	"October 7, 1964"	"Childrens; Classics; Fiction; Picture Books; Poetry; Young Adult; Fantasy"	"Unknown"	"Unknown"	"9780060256654"	"English"	"https://www.goodreads.com/book/show/370493.The_Giving_Tree"
"Where the Wild Things Are"	"None"	"Maurice Sendak"	"4.25"	"1,054,973"	"14,709"	"Max, a wild and naughty boy, is sent to bed without his supper by his exhausted mother. In his room, he imagines sailing far away to a land of Wild Things. Instead of eating him, the Wild Things make Max their king."	"38"	"January 1, 2000"	"Childrens; Picture Books; Fiction; Classics; Fantasy; Adventure; Young Adult"	"Unknown"	"Max Cannon"	"9780099408390"	"English"	"https://www.goodreads.com/book/show/19543.Where_the_Wild_Things_Are"
"The BENEFITS Of JESUS' SUFFERINGS: DISCOVER WHY JESUS SUFFERED & ALL THE CORRESPONDING BENEFITS HE HAS ACCOMPLISHED FOR YOU"	"None"	"Timothy E. Ashton"	"4.50"	"179"	"72"	""	"277"	"November 20, 2023"	"Unknown"	"Unknown"	"Unknown"	"9798868313868"	"English"	"https://www.goodreads.com/book/show/202512054-the-benefits-of-jesus-sufferings"
"Dr. Seuss's How the Grinch Lost Christmas!"	"None"	"Alastair Heim; Aristides Ruiz"	"4.34"	"28,518"	"171"	"The Grinch is BACK and ready to prove to the residents of Who- ville that he's changed. This heartwarming sequel is written and illustrated in the style of Dr. Seuss's beloved holiday classic How the Grinch Stole Christmas!The Grinch had been patiently waiting all year,To celebrate Christmas and bring the Whos cheer,And to show every Who he was DIFFERENT now.“I’ve changed!” thought the Grinch,“And I’ll prove it! But HOW ?”A year has passed since the Grinch stole Christmas from Who- ville. Now eager to prove to the Whos that his heart has grown to LOVE the holiday, the Grinch devises a plan to win Who -ville's Christmas Crown by making the largest, most spectacular Christmas tree the Whos have ever seen!But when things don't go as planned, the Grinch's heart turns ice cold, and he threatens to leave Who- ville for good...until one small, special Who reminds him that Christmas is NOT about winning.Grow your heart three sizes MORE with this sequel to the timeless picture book How the Grinch Stole Christmas! Featuring a foil-enhanced jacket and full-color illustrations rendered in the iconic style of the original, this new story makes a splendid gift and a must-have addition to the libraries of Grinch fans of all ages!Show more"	"40"	"September 5, 2023"	"Christmas; Picture Books; Childrens; Holiday; Fiction; Poetry; Classics"	"Unknown"	"Unknown"	"9780593563168"	"English"	"https://www.goodreads.com/book/show/112976351-dr-seuss-s-how-the-grinch-lost-christmas"
"Wonka"	"None"	"Sibéal Pounder; Roald Dahl; Simon Farnaby"	"4.09"	"30,254"	"530"	"WONKA tells the wondrous story of how the world's greatest inventor, magician and chocolate-maker becomes the beloved Willy Wonka we know today.Based on the upcoming Warner Bros. Pictures movie WONKA, created by Paul King and written for film by Simon Farnaby and Paul King.An intoxicating mix of magic and music, mayhem and emotion, all told with fabulous heart and humour - WONKA introduces readers to a young Willy Wonka, chock-full of ideas and determined to change the world one delectable bite at a time . . . proving that the best things in life begin with a dream, and if you're lucky enough to meet Willy Wonka, anything is possible.Show more"	"328"	"December 7, 2023"	"Fantasy; Fiction; Middle Grade; Audiobook; Childrens; Adventure; Magic"	"Unknown"	"Unknown"	"9780241618141"	"English"	"https://www.goodreads.com/book/show/188183291-wonka"
"Charlie and the Chocolate Factory"	"Charlie Bucket"	"Roald Dahl; Quentin Blake"	"4.17"	"924,342"	"18,731"	"Charlie Bucket's wonderful adventure begins when he finds one of Mr. Willy Wonka's precious Golden Tickets and wins a whole day inside the mysterious chocolate factory. Little does he know the surprises that are in store for him!(back cover)"	"176"	"June 2, 2005"	"Fiction; Fantasy; Classics; Childrens; Young Adult; Middle Grade; Humor"	"Unknown"	"Charlie Bucket,Willy Wonka,Violet Beauregarde,Veruca Salt,Augustus Gloop,Mike Teavee,Grandpa Joe"	"9780142403884"	"English"	"https://www.goodreads.com/book/show/6310.Charlie_and_the_Chocolate_Factory"
"Cat Kid Comic Club"	"Cat Kid Comic Club"	"Dav Pilkey"	"3.96"	"55,767"	"651"	"A pioneering new graphic novel series by Dav Pilkey, the author and illustrator of the internationally bestselling Dog Man and Captain Underpants series.Naomi, Melvin, Pedro, and Poppy are just a few of the twenty-one rambunctious, funny, and talented baby frogs who share their stories in the Cat Kid Comic Club. Can Li'l Petey, Molly, and Flippy help the students express themselves through comics? The adventures in class and on paper unwind with mishaps and hilarity as the creative baby frogs experience the mistakes and progress that come with practice and persistence."Squid Kid and Katydid," "Baby Frog Squad," "Monster Cheese Sandwich," "Birds Flowers Trees: A Haiku Photo Comic," and other mini-comics are featured as stories-within-the-story, each done in a different style, utilizing humor and drama, prose and poetry, illustrated in different media including acrylics, pastels, colored pencils, felt-tip markers, clay, hand-made cardboard sculptures, photographs, pipe cleaners, construction paper collages, and cookies.This heartfelt, humorous, and thoughtful graphic novel by award-winning author and artist Dav Pilkey will have readers of all ages laughing and motivated to unleash their own creativity.Show more"	"176"	"December 1, 2020"	"Graphic Novels; Childrens; Comics; Humor; Middle Grade; Fiction; Fantasy"	"Unknown"	"Unknown"	"9781338712773"	"English"	"https://www.goodreads.com/book/show/52891759-cat-kid-comic-club"
"Batman vs. The Incredible Hulk"	"DC Special Series (1977-1981)"	"Len Wein; Dick Giordano; José Luis García-López"	"3.96"	"40,094"	"112"	"In a history-making confrontation with the mightiest man-brute to ever walk the Earth!So pull up a ringside seat for the single most astonishing epic in the annals of of Adventuredom! Join us to meet -The Monster and The Madman!Also featuring the vile villainy of the Joker and the Shaper of the Worlds!Show more"	"Mass"	"January 1, 1982"	"Comics; Batman; Graphic Novels; Marvel; Comic Book; Dc Comics; Superheroes"	"Unknown"	"Unknown"	"9780446302449"	"English"	"https://www.goodreads.com/book/show/1357150.Batman_vs_The_Incredible_Hulk"
"Zero Year: Part 1"	"DC Comics - Legenda o Batmanovi"	"Scott Snyder; Greg Capullo; Rafael Albuquerque"	"3.80"	"2,090"	"23"	"Five years after he disappeared Bruce Wayne has returned to Gotham City, determined to wage a secret war on crime. The city is in the merciless grip of the Red Hood gang, many of whose members have been blackmailed into a life of crime by the mysterious Red Hood Number One. Before long Bruce is forced out into the open and his return becomes public. In order to continue his fight he decides that he must become something more - the Batman!Contents: Batman #21-26"	"184"	"December 1, 2017"	"Comics; Batman; Graphic Novels; Superheroes; Dc Comics; Graphic Novels Comics; Crime"	"Unknown"	"Unknown"	"Unknown"	"English"	"https://www.goodreads.com/book/show/37660517-zero-year"
