"Title"	"Series"	"Contributors"	"Average Rating"	"Number of Ratings"	"Number of Reviews"	"Description"	"Number of Pages"	"Publishing Date"	"Genres"	"Setting"	"Characters"	"ISBN"	"Language"	"URL"
"The 4-Hour Workweek"	"None"	"Timothy Ferriss"	"3.91"	"330,662"	"10,047"	"What do you do? Tim Ferriss has trouble answering the question. Depending on when you ask this controversial Princeton University guest lecturer, he might answer: "I race motorcycles in Europe." "I ski in the Andes." "I scuba dive in Panama." "I dance tango in Buenos Aires." He has spent more than five years learning the secrets of the New Rich, a fast-growing subculture who has abandoned the "deferred-life plan" and instead mastered the new currencies-time and mobility-to create luxury lifestyles in the here and now. Whether you are an overworked employee or an entrepreneur trapped in your own business, this book is the compass for a new and revolutionary world.Join Tim Ferriss as he teaches you:- How to outsource your life to overseas virtual assistants for $5 per hour and do whatever you want?- How blue-chip escape artists travel the world without quitting their jobs?- How to eliminate 50% of your work in 48 hours using the principles of a forgotten Italian economist?- How to trade a long-haul career for short work bursts and freuent "mini-retirements"?- What the crucial difference is between absolute and relative income?- How to train your boss to value performance over presence, or kill your job (or company) if it's beyond repair?- What automated cash-flow "muses" are and how to create one in 2 to 4 weeks?- How to cultivate selective ignorance-and create time-with a low-information diet?- What the management secrets of Remote Control CEOs are?- How to get free housing worldwide and airfare at 50-80% off?- How to fill the void and create a meaningful life after removing work and the officeShow more"	"308"	"April 24, 2007"	"Business; Nonfiction; Self Help; Productivity; Personal Development; Finance; Entrepreneurship"	"Unknown"	"Unknown"	"9780307353139"	"English"	"https://www.goodreads.com/book/show/368593.The_4_Hour_Workweek"
"Rich Dad, Poor Dad"	"Rich Dad"	"Robert T. Kiyosaki"	"4.10"	"713,266"	"26,875"	"Rich Dad Poor Dad is Robert's story of growing up with two dads — his real father and the father of his best friend, his "rich dad" — and the ways in which both men shaped his thoughts about money and investing. The book explodes the myth that you need to earn a high income to be rich and explains the difference between working for money and having your money work for you."	"195"	"December 31, 2001"	"Finance; Business; Nonfiction; Self Help; Money; Personal Finance; Personal Development"	"Unknown"	"Unknown"	"9780751532715"	"English"	"https://www.goodreads.com/book/show/69571.Rich_Dad_Poor_Dad"
"Crime and Punishment"	"None"	"Fyodor Dostoevsky; David McDuff; Joseph Frank"	"4.28"	"1,060,284"	"50,355"	"Raskolnikov, a destitute and desperate former student, wanders through the slums of St Petersburg and commits a random murder without remorse or regret. He imagines himself to be a great man, a Napoleon: acting for a higher purpose beyond conventional moral law. But as he embarks on a dangerous game of cat and mouse with a suspicious police investigator, Raskolnikov is pursued by the growing voice of his conscience and finds the noose of his own guilt tightening around his neck. Only Sonya, a downtrodden sex worker, can offer the chance of redemption."	"671"	"December 31, 2002"	"Classics; Fiction; Russia; Russian Literature; Literature; Philosophy; Novels"	"Russian Empire,Siberia(Russian Federation),Russia,St. Petersburg, Russia"	"Rodion Romanovich Raskolnikov,Porfiry Petrovich,Sofia Semyonovna Marmeladova,Avdotya Romanovna Raskolnikova,Arkady Ivanovich Svidrigailov,Dmitri Prokofich Razumikhin,Katerina Ivanovna Marmeladova,Pyotr Petrovich Luzhin,Pulcheria Alexandrovna Raskolnikov,Semyon Zakharovich Marmeladov,Andrei Semyonovich Lebezyatnikov,Alyona Ivanovna,Lizaveta Ivanovna,Zossimov,Nastasya Petrovna (“Nastenka,” “Nastasyushka”),Ilya Petrovich (“Gunpowder”),Alexander Grigorievich Zamyotov,Nikolai Dementiev (“Mikolka”),Polina Mikhailovna Marmeladov (“Polya,” “Polenka,” “Polechka”)Show more"	"Unknown"	"English"	"https://www.goodreads.com/book/show/7144.Crime_and_Punishment"
"The Master and Margarita"	"None"	"Mikhail Bulgakov; Diana Lewis Burgin; Katherine Tiernan O'Connor"	"4.28"	"413,855"	"27,265"	"The first complete, annotated English Translation of Mikhail Bulgakov's comic masterpiece.An audacious revision of the stories of Faust and Pontius Pilate,The Master and Margaritais recognized as one of the essential classics of modern Russian literature. The novel's vision of Soviet life in the 1930s is so ferociously accurate that it could not be published during its author's lifetime and appeared only in a censored edition in the 1960s. Its truths are so enduring that its language has become part of the common Russian speech.One hot spring, the devil arrives in Moscow, accompanied by a retinue that includes a beautiful naked witch and an immense talking black cat with a fondness for chess and vodka. The visitors quickly wreak havoc in a city that refuses to believe in either God or Satan. But they also bring peace to two unhappy Muscovites: one is the Master, a writer pilloried for daring to write a novel about Christ and Pontius Pilate; the other is Margarita, who loves the Master so deeply that she is willing literally to go to hell for him. What ensues is a novel of inexhaustible energy, humor, and philosophical depth, a work whose nuances emerge for the first time in Diana Burgin's and Katherine Tiernan O'Connor's splendid English version.Show more"	"372"	"March 1, 1996"	"Classics; Fiction; Fantasy; Russia; Russian Literature; Magical Realism; Literature"	"Moscow(Russian Federation),Russia,Jerusalem(Israel)"	"Lucifer,Pontius Pilate,Behemot,Master,Margarita Nicolaevna,Ivan Nikolayevich Ponyryov,Yeshua Ha-Nozri,Mikhail Alexandrovich Berlioz,Hella (The Master and Margarita),Stephan Bogdanovich Likhodeyev,Natasha (The Master and Margarita),Korovyev,Azazello"	"9780679760801"	"English"	"https://www.goodreads.com/book/show/117833.The_Master_and_Margarita"
"The Brothers Karamazov"	"None"	"Fyodor Dostoevsky; Richard Pevear; Larissa Volokhonsky"	"4.39"	"381,044"	"24,174"	"The Brothers Karamazov is a murder mystery, a courtroom drama, and an exploration of erotic rivalry in a series of triangular love affairs involving the “wicked and sentimental” Fyodor Pavlovich Karamazov and his three sons―the impulsive and sensual Dmitri; the coldly rational Ivan; and the healthy, red-cheeked young novice Alyosha. Through the gripping events of their story, Dostoevsky portrays the whole of Russian life, is social and spiritual striving, in what was both the golden age and a tragic turning point in Russian culture.This award-winning translation by Richard Pevear and Larissa Volokhonsky remains true to the verbal inventiveness of Dostoevsky’s prose, preserving the multiple voices, the humor, and the surprising modernity of the original. It is an achievement worthy of Dostoevsky’s last and greatest novel.Show more"	"796"	"June 14, 2002"	"Classics; Fiction; Russia; Russian Literature; Philosophy; Literature; Novels"	"Russia"	"Dmitri Fyodorovich Karamazov,Ivan Fyodorovich Karamazov,Alexei Fyodorovich Karamazov,Pavel Smerdyakov,Agrafena Alexandrovna Svetlova,Katerina Ivanovna Verkhovtseva,Fyodor Pavlovich Karamazov,Father Zosima, the Elder,Ilyusha Snegiryov,Nikolai Krassotkin,Katerina Ospovna Khokhlakov,Liza Khokhlakov,Mikhail Osipovich Rakitin,Dmitri Fyodorovich Karamazov"	"9780374528379"	"English"	"https://www.goodreads.com/book/show/4934.The_Brothers_Karamazov"
"War and Peace"	"None"	"Leo Tolstoy; Aylmer Maude; Louise Maude"	"4.17"	"362,589"	"20,236"	"In Russia's struggle with Napoleon, Tolstoy saw a tragedy that involved all mankind.War and Peacebroadly focuses on Napoleon’s invasion of Russia in 1812 and follows three of the most well-known characters in literature: Pierre Bezukhov, the illegitimate son of a count who is fighting for his inheritance and yearning for spiritual fulfillment; Prince Andrei Bolkonsky, who leaves his family behind to fight in the war against Napoleon; and Natasha Rostov, the beautiful young daughter of a nobleman who intrigues both men.As Napoleon’s army invades, Tolstoy brilliantly follows characters from diverse backgrounds—peasants and nobility, civilians and soldiers—as they struggle with the problems unique to their era, their history, and their culture. And as the novel progresses, these characters transcend their specificity, becoming some of the most moving—and human—figures in world literature.Tolstoy gave his personal approval to this translation, published here in a new single volume edition, which includes an introduction by Henry Gifford, and Tolstoy's important essay `Some Words about War and Peace'.Show more"	"1392"	"June 25, 1998"	"Classics; Fiction; Historical Fiction; Russia; Russian Literature; Literature; War"	"Russia,St. Petersburg, Russia,Moscow(Russian Federation)"	"Pierre Bezukhov,Natasha Rostova,Nikolai Rostov,Ilya Rostov,Petya Rostov,Helene Kuragina,Anna Scherer,Lise Bolkonskaya,Platon Karataev,Vasili Denisov,Anna Drubetskaya,Nikolai Bolkonsky,Mikhail Kutuzov,Vera Rostova,Prince Andrey Bokonsky,Boris Drubetskoy,Sonya Rostova,Anatole Kuragin,Mademoiselle Bourienne,Maria Bolkonskaya,Fedja Dolochov,Adolf Berg,Osip Basdeev"	"9780192833983"	"English"	"https://www.goodreads.com/book/show/656.War_and_Peace"
"The Idiot"	"None"	"Fyodor Dostoevsky; Anna Brailovsky; Joseph Frank"	"4.21"	"213,927"	"11,747"	"Returning to Russia from a sanitarium in Switzerland, the Christ-like epileptic Prince Myshkin finds himself enmeshed in a tangle of love, torn between two women—the notorious kept woman Nastasya and the pure Aglaia—both involved, in turn, with the corrupt, money-hungry Ganya. In the end, Myshkin’s honesty, goodness, and integrity are shown to be unequal to the moral emptiness of those around him. In her revision of the Garnett translation, Anna Brailovsky has corrected inaccuracies wrought by Garnett’s drastic anglicization of the novel, restoring as much as possible the syntactical structure of the original story."	"667"	"April 8, 2003"	"Classics; Fiction; Russia; Russian Literature; Literature; Philosophy; Novels"	"St. Petersburg, Russia,Russian Empire"	"Prince Myshkin,Nastasya Filippovna,Rogozhin"	"9780679642428"	"English"	"https://www.goodreads.com/book/show/12505.The_Idiot"
"Dead Souls"	"None"	"Nikolai Gogol; Robert A. Maguire"	"3.98"	"95,301"	"5,019"	"Chichikov, a mysterious stranger, arrives in a provincial town and visits a succession of landowners to make each a strange offer. He proposes to buy the names of dead serfs still registered on the census, saving their owners from paying taxes on them, and to use these 'souls' as collateral to re-invent himself as a gentleman. In this ebullient masterpiece, Gogol created a grotesque gallery of human types, from the bear-like Sobakevich to the insubstantial fool Manilov, and, above all, the devilish con man Chichikov.Dead Souls, Russia's first major novel, is one of the most unusual works of nineteenth-century fiction and a devastating satire on social hypocrisy.In his introduction to this new translation, Robert A. Maguire discusses Gogol's life and literary career, his depiction of Russian society, and the language and narrative techniques employed inDead Souls. This edition also includes a chronology, further reading, appendices, a glossary, map and notes.Show more"	"464"	"December 28, 2004"	"Classics; Fiction; Russia; Russian Literature; Literature; Novels; 19th Century"	"Russia"	"Pavel Ivanovitch Tchitchikof"	"9780140448078"	"English"	"https://www.goodreads.com/book/show/28381.Dead_Souls"
"A Hero of Our Time"	"None"	"Mikhail Lermontov; Paul Foote"	"4.11"	"63,748"	"2,846"	"In its adventurous happenings, its abductions, duels, and sexual intrigues,A Hero of Our Timelooks backward to the tales of Sir Walter Scott and Lord Byron, so beloved by Russian society in the 1820s and '30s. In the character of its protagonist, Pechorin, the archetypal Russian antihero, Lermontov's novel looks forward to the subsequent glories and passion of Russian literature that it helped, in great measure, to make possible."	"185"	"January 1, 1966"	"Classics; Fiction; Russia; Russian Literature; Literature; 19th Century; Novels"	"Caucasus"	"Grigory Alexandrovich Pechorin,Maxim Maximytch,Bela,Kazbich,Princess Mary,Grushnitsky,Vera (A Hero of Our Time),Dr. Werner,Vulich"	"9780140441765"	"English"	"https://www.goodreads.com/book/show/226378.A_Hero_of_Our_Time"
"Eugene Onegin"	"None"	"Alexander Pushkin; James E. Falen"	"4.10"	"70,252"	"2,861"	"Eugene Oneginis the master work of the poet whom Russians regard as the fountainhead of their literature. Set in 1820s Russia, Pushkin's verse novel follows the fates of three men and three women. Engaging, full of suspense, and varied in tone, it also portrays a large cast of othercharacters and offers the reader many literary, philosophical, and autobiographical digressions, often in a highly satirical vein.Eugene Oneginwas Pushkin's own favourite work, and this new translation conveys the literal sense and the poetic music of the original."	"240"	"October 22, 1998"	"Classics; Poetry; Russia; Fiction; Russian Literature; Literature; 19th Century"	"Russia,Moscow(Russian Federation),St. Petersburg, Russia"	"Eugene Onegin,Vladimir Lensky,Tatyana Larina,Olga Larina,Zaretsky,Larina"	"Unknown"	"English"	"https://www.goodreads.com/book/show/27822.Eugene_Onegin"
"Горе от ума"	"Russian Library"	"Alexander Griboyedov; Александр Сергеевич Грибоедов"	"4.13"	"16,676"	"210"	""Горе от ума" - одна из первых русских комедий, разодранных на пословицы и поговорки, которыми до сих пор украшена речь всякого мало-мальски начитанного человека."Горе от ума" - комедия, давшая русской литературе первого "лишнего человека".Эта комедия с трагическим, в сущности, финалом - поистине "русская комедия" с отчетливым горьким осадком и бесконечным сочувствием герою.Издание снабжено комментарием, а также отрывками из статей А.С.Пушкина, И.А.Гончарова и А.Григорьева, посвященных комедии "Горе от ума", что, несомненно, поможет всем, кто изучает русскую словесность.Show more"	"206"	"January 1, 2001"	"Classics; Russia; Fiction; Russian Literature; Plays; Poetry; Drama"	"Unknown"	"Unknown"	"9785080039157"	"Russian"	"https://www.goodreads.com/book/show/97390._"
"Mumu"	"None"	"Ivan Turgenev"	"3.78"	"10,984"	"267"	"Mumu (Russian: «Муму») is a short story by Ivan Turgenev, a Russian novelist and story writer, written in 1854.The story of Gerasim, a deaf and mute serf whose life of poverty is brought into sharp relief by his connection with Mumu, a dog he rescued, brought greater national attention to the cruelties of serfdom, and received praise for its brutal portrayal of this institution in Russian society."	"60"	"December 8, 2005"	"Classics; Russia; Russian Literature; Fiction; Short Stories; Literature; School"	"Unknown"	"The landlady,Gerasim,Mumu,Tatiana,Kapiton Klimov"	"9781425469276"	"English"	"https://www.goodreads.com/book/show/879879.Mumu"
"The Da Vinci Code"	"Robert Langdon"	"Dan    Brown"	"3.93"	"2,506,198"	"59,526"	"This is an alternate cover for 9780307277671. Others can be found:here,here,here,here,andhereWhile in Paris on business, Harvard symbologist Robert Langdon receives an urgent late-night phone call: the elderly curator of the Louvre has been murdered inside the museum. Near the body, police have found a baffling cipher. While working to solve the enigmatic riddle, Langdon is stunned to discover it leads to a trail of clues hidden in the works of Da Vinci -- clues visible for all to see -- yet ingeniously disguised by the painter.Langdon joins forces with a gifted French cryptologist, Sophie Neveu, and learns the late curator was involved in the Priory of Sion -- an actual secret society whose members included Sir Isaac Newton, Botticelli, Victor Hugo, and Da Vinci, among others.In a breathless race through Paris, London, and beyond, Langdon and Neveu match wits with a faceless powerbroker who seems to anticipate their every move. Unless Langdon and Neveu can decipher the labyrinthine puzzle in time, the Priory's ancient secret -- and an explosive historical truth -- will be lost forever.The Da Vinci Codeheralds the arrival of a new breed of lightning-paced, intelligent thriller utterly unpredictable right up to its stunning conclusion.Show more"	"489"	"March 28, 2006"	"Fiction; Mystery; Thriller; Mystery Thriller; Historical Fiction; Suspense; Adventure"	"France,England,Paris(France),United Kingdom"	"Sophie Neveu,Robert Langdon,Sir Leigh Teabing,Silas (The Da Vinci Code),Bezu Fache,Jerome Collet,Manuel Aringarosa,Rémy Legaludec,André Vernet"	"Unknown"	"English"	"https://www.goodreads.com/book/show/968.The_Da_Vinci_Code"
"The Girl With the Dragon Tattoo"	"Millennium"	"Stieg Larsson; Reg Keeland"	"4.18"	"3,420,839"	"83,274"	"Harriet Vanger, a scion of one of Sweden’s wealthiest families disappeared over forty years ago. All these years later, her aged uncle continues to seek the truth. He hires Mikael Blomkvist, a crusading journalist recently trapped by a libel conviction, to investigate. He is aided by the pierced and tattooed punk prodigy Lisbeth Salander. Together they tap into a vein of unfathomable iniquity and astonishing corruption.An international publishing sensation, Stieg Larsson’s The Girl with the Dragon Tattoo combines murder mystery, family saga, love story, and financial intrigue into one satisfyingly complex and entertainingly atmospheric novel.Show more"	"480"	"September 23, 2008"	"Fiction; Mystery; Thriller; Crime; Mystery Thriller; Book Club; Suspense"	"Stockholm(Sweden),Hedeby Island(Sweden),Hedestad, Stockholm(Sweden),Sweden"	"Lisbeth Salander,Mikael Blomkvist,Erika Berger,Dragan Armansky,Henrik Vanger,Martin Vanger,Cecilia Vanger,Hans-Erik Wennerström,Harriet Vanger,Holger Palmgren,Nils Bjurman,Anita Vanger,Birger Vanger,Dirch Frode,Christer Malm,Gustaf Morell,Isabella Vanger,Gottfried Vanger,Jan Köbin"	"9780670069019"	"English"	"https://www.goodreads.com/book/show/2429135.The_Girl_With_the_Dragon_Tattoo"
"Angels & Demons"	"Robert Langdon"	"Dan    Brown"	"3.95"	"3,376,016"	"37,040"	"An ancient secret brotherhood.A devastating new weapon of destruction.When world-renowned Harvard symbologist Robert Langdon is summoned to a Swiss research facility to analyze a mysterious symbol -- seared into the chest of a murdered physicist -- he discovers evidence of the unimaginable: the resurgence of an ancient secret brotherhood known as the Illuminati...the most powerful underground organization ever to walk the earth. The Illuminati has now surfaced to carry out the final phase of its legendary vendetta against its most hated enemy -- the Catholic Church.Langdon's worst fears are confirmed on the eve of the Vatican's holy conclave, when a messenger of the Illuminati announces they have hidden an unstoppable time bomb at the very heart of Vatican City. With the countdown under way, Langdon jets to Rome to join forces with Vittoria Vetra, a beautiful and mysterious Italian scientist, to assist the Vatican in a desperate bid for survival.Embarking on a frantic hunt through sealed crypts, dangerous catacombs, deserted cathedrals, and even the most secretive vault on earth, Langdon and Vetra follow a 400-year-old trail of ancient symbols that snakes across Rome toward the long-forgotten Illuminati lair...a clandestine location that contains the only hope for Vatican salvation.An explosive international thriller,Angels & Demonscareens from enlightening epiphanies to dark truths as the battle between science and religion turns to war.Show more"	"736"	"April 1, 2006"	"Fiction; Mystery; Thriller; Mystery Thriller; Suspense; Adventure; Crime"	"Rome(Italy),Vatican City(Italy),Italy,Switzerland,Geneva(Switzerland)"	"Vittoria Vetra,Robert Langdon,Leonardo Vetra,Gunther Glick,Maximilian Kohler,Camerlengo Carlo Ventresca"	"9781416524793"	"English"	"https://www.goodreads.com/book/show/960.Angels_Demons"
"The DaVinci Code: A Quest for Answers"	"None"	"Josh McDowell"	"4.46"	"111,219"	"333"	"Just where does fact end and fiction begin? The brilliant mix of fact and fiction in Dan Brown's Conspiracy story "The Da Vinci Code" raises serious questions regarding the origins and claims of Christianity. Many come away from the book shaken in their beliefs, wondering what is true? Questions like "Was Mary Magdalene really Jesus' wife and the mother of his child?" And more. McDowell skillfully separates facts from fallacy. This is a book you and your friends should have right now! One reviewer wrote "An excellent little book and very easy read. Written as an ongoing discussion among three college students who saw the DaVinci Code movie and then had many questions about the supposed "facts" in the book...only to discover that author Dan Brown is a brilliant author, but lousy historian who fabricates most of his "facts." An excellent little book that really makes you think and want to dig for the truth!" by Mr. Michael A. Dorough "uth dude" (Warner Robins, GA)Show more"	"120"	"January 1, 2006"	"Fiction; Mystery; Thriller; Christian; Classics; Religion; Mystery Thriller"	"Unknown"	"Unknown"	"9781932587807"	"English"	"https://www.goodreads.com/book/show/6372.The_DaVinci_Code"
"Dan Brown Inferno (Robert Langdon) Unofficial Guide"	"None"	"Stephen Eastment; Stephen Harvard"	"4.32"	"65,576"	"77"	"The Dan Brown Inferno Unofficial Guide will allow you to decode the masterful and clever codes, symbols and art history of Dan Brown's fourth international blockbuster, Inferno and follow in the footsteps of the great puzzle solver Robert Langdon. Dan Brown's new international blockbuster, Inferno, will be his fourth book fusing history, art, codes and symbols. This guide includes:A Complete Summary of Dante's Inferno on which Dan Brown has based his newest bestselling novelA Complete Guide to the Many Levels of Hell in Dante's InfernoA Complete List of Characters and People that appear in Dante's Inferno and their origins in Biblical and Classical mythologyTranslation of the important Latin phrases contained in Dante's InfernoShow more"	"119"	"August 9, 2013"	"Fiction; Thriller; Mystery; Mystery Thriller; Drama; Classics; Suspense"	"Unknown"	"Unknown"	"9781456613303"	"Unknown"	"https://www.goodreads.com/book/show/17587594-dan-brown-inferno-robert-langdon-unofficial-guide"
"Origin: Free Sampler"	"None"	"Dan    Brown"	"4.36"	"12,837"	"104"	"An extract fromOrigin.Dan Brown’s new novel,Origin, features renowned Harvard symbologist Robert Langdon and is set in Spain, where Langdon is drawn into a terrifying race against time that will bring him face-to-face with a world-shaking truth that has remained buried – until now.This preview includes the prologue and first chapter ofOrigin."	"27"	"September 13, 2017"	"Fiction; Thriller; Mystery; Romance; Novels"	"Unknown"	"Unknown"	"Unknown"	"English"	"https://www.goodreads.com/book/show/36232020-origin"
"Dan Brown's The Lost Symbol"	"None"	"Nigel Tomm"	"4.26"	"11,942"	"81"	"Despite its title, this book doesnotplagiarize Dan Brown's newest novel, "The Lost Symbol." It is an original text installation by author Nigel Tomm."	"244"	"September 2, 2009"	"Fiction; Thriller; Mystery; Suspense; Adventure; Novels"	"Unknown"	"Unknown"	"Unknown"	"English"	"https://www.goodreads.com/book/show/6802629-dan-brown-s-the-lost-symbol"
